{
  "goal_command": "바탕화면 정리 기능 4개가 'AI 제안 → 사용자 승인 → 정리' 플로우로 동작하고 빌드가 통과할 때까지 멈추지 말고 macOS 메뉴바 앱을 구현한다. 각 마일스톤이 끝나면 다음을 실행해 결과를 출력에 남긴다: `swift build`가 exit 0으로 통과; 앱 실행 후 메뉴바 항목 4개(바탕화면/다운로드/스크린샷/중복찾기)가 로그에 표시; 정리 시뮬레이션에서 사용자 승인 없이 이동된 파일 수가 0으로 출력. 다음 제약은 바뀌면 안 된다: 파일 이동·삭제는 반드시 사용자 승인(클릭) 후에만 실행; 화면·집중 세트, 클립보드 세트, 클라우드 동기화는 구현하지 않는다. 종료 안전장치: 위가 모두 충족되면 완료, 또는 25턴 후 멈춘다 (or stop after 25 turns), 빌드가 3회 연속 실패하면 자체 수정을 멈추고 사람의 결정을 기다린다.",
  "goal": "매일 쓰지만 익숙해서 참고 쓰던 사소한 '파일 정리' 작업을 자동화하는 macOS 메뉴바 앱을 만든다. 첫 핵심은 '바탕화면 깔끔 정리' — 구독 중인 AI가 항목을 분석해 정리안을 제안하고, 사용자가 승인·클릭해야만 정리한다.",
  "context": "1차 사용자는 본인. 바탕화면/다운로드가 늘 어질러지는데 매번 수동으로 치우던 불편을 줄이는 게 목적. AI는 분류 제안에만 쓰고 실제 이동은 사용자 승인 뒤에만 일어나는 안전 게이트를 둔다.",
  "domain": "code",
  "scale": "mvp",
  "success_criteria": [
    "사용자 승인 없이 이동되는 파일 수가 0건으로 출력된다",
    "파일 정리 기능 4개(바탕화면/다운로드/스크린샷/중복찾기)가 각각 메뉴바에서 실행·동작한다",
    "정리 후 `ls ~/Desktop | wc -l` 결과가 사용자 지정 목표치(예: 10) 이하로 출력된다"
  ],
  "done_definition": "Swift+SwiftUI 메뉴바 앱이 `swift build` 통과 후 메뉴바에 상주하고, 4개 기능이 'AI 제안→승인→정리'로 동작함을 직접 실행 출력으로 확인한 상태",
  "verification_method": "각 기능을 실행해 결과를 출력에 남기고, 승인 없는 파일 이동이 0건인지 매 반복 확인한다",
  "risk_tier": "elevated",
  "safety": {
    "permissions_needed": ["풀디스크액세스(바탕화면/다운로드 접근)"],
    "destructive_ops": ["파일 이동", "중복 파일 삭제 후보 처리"],
    "approval_gate": "모든 파일 이동·삭제는 사용자 클릭 승인 후에만 실행",
    "privacy_notes": "바탕화면 파일명·메타데이터를 분류용으로 AI에 전달. 파일 내용 본문은 보내지 않음"
  },
  "constraints": [
    "파일 이동·삭제는 사용자 확인(클릭) 후에만 — 자동 이동 금지",
    "구독 중인 AI 서비스를 분류 제안에 활용 (별도 유료 API 신설 최소화)",
    "Swift + SwiftUI 네이티브, macOS 메뉴바 앱"
  ],
  "out_of_scope": [
    "화면·집중 세트(회의모드/다크모드 토글), 클립보드·텍스트 세트 — 다음 버전",
    "클라우드 동기화, 다른 사용자 대상 배포·앱스토어 출시"
  ],
  "risks": [
    "중요 파일을 잘못 분류·이동할 위험 → 사용자 승인 게이트로 완화",
    "바탕화면/파일 접근에 풀디스크액세스·샌드박스 권한이 필요할 수 있음",
    "AI(LLM) 호출 비용·지연·오분류 가능성"
  ],
  "loop_config": {
    "max_iterations": 25,
    "stop_condition": "반복 25회 초과 또는 빌드 실패 3회 연속, 또는 사용자 승인 없는 파일 이동이 1건이라도 발생",
    "checkpoint": "iteration마다 git commit"
  },
  "confidence": "high",
  "status": "ready"
}
